{
  "capture_policy": "optional",
  "claim_ids": [
    "djt:claim:6f4693528e49052ff8ca36a8fdec45f97da6ef4d06b7aaa07ecea20a13e56b27",
    "djt:claim:47eb48a02bf4cb1c864506db092efeb812a88d4ad44663999f2a4e94996d8d6a",
    "djt:claim:bba13489cfdc8465f22cf8e90c1eeab8ba31279bee8daae7dbac8ab1ab3ed06f",
    "djt:claim:6cfe2e64f85cd7ad9f618b48380a8819b76217cd590cd49b12b96591130f5243",
    "djt:claim:4f322b042034ad2a888226f681bcde12751ea4294efc0dcfbffb090805b93e5a",
    "djt:claim:f8a53a490951f7b97fb28b68c25fae01e7bc7b0affcc8b183216d5d489a5e948",
    "djt:claim:9cf4f17226395616be2066434d01e8e46c4cdec67091d3af91cd2dc4484f90ee",
    "djt:claim:ea627739f8837e7177cc4e03c995a13001696db7180c778fd4138b334939f038",
    "djt:claim:677f007e123147193c54b0d3353f283674af34be95521bd1d4f9add1226c3e41",
    "djt:claim:5520cf644da19f169a241797f86874658bba98033351b9e10b30c55567a20aac",
    "djt:claim:c5bb02becf668780fea2afd02ba7e4251ff5ae0850373cba28006a5194ab207f",
    "djt:claim:fe88269043ac6f71f8538edf2002aa90ddfdba922e08669e3b4ab5c190cc9e4a",
    "djt:claim:b24e9ceb6dc7511e6f50ed7a4f24203670a5f9f6bb49dd684ed606119824f69a",
    "djt:claim:d1e24f9ce8f05974e399f446a50bd97117ff18bae6a38e23c75e5552b676ad45",
    "djt:claim:3e03f29d4b46167ee76539e44d08cadf2b277756b4c38d3cbf48e328ee9b1bd2",
    "djt:claim:b0ad0f5dc3b01aa54a2db9d1ddeeecd9b3e814b179c2a499b9c94395986a7d51",
    "djt:claim:adf11d87ee11c5239e50edd869b7a0f24ee8ae897dd7efbd6d94dc18284e44db",
    "djt:claim:f8ee6de3982cceb3079447fb104b826a4f307c5466cdcbb6572f57bbd9fb5ad0",
    "djt:claim:6252b47fb54cbd856577ba31f48f85b5f8838c4ddcc37d23612806574282c9f6",
    "djt:claim:d2ebb6319a232fee16b049afc74e69191df48186df6faadf153354005609ee5e",
    "djt:claim:548004c00886625fd2b04d044c2f7f0a539392beba00449b35a3bb104305f808",
    "djt:claim:786ee9707a4df3f632b1dfbd806e76ab7f536918b85111ce5c2e81ee462ecb31",
    "djt:claim:9663cddb5b1a320f05381152fe5799876fe253bf1675ed49f9bc3ad13fbb2393",
    "djt:claim:31b7265fc94c941a7885159f793ba0cc5d402ab45da30ce4f5533caa34098103",
    "djt:claim:afb308655b37c20f19e89a6995a957e5d00bb677c66222a8e1df67511d78823d",
    "djt:claim:1c58546e17e1ac9bf8d16976fe9f26cf8d9fdde84207a07e9a5ae621da9a7128",
    "djt:claim:cbdc44049f52557e64ffc3f10e2a943f3d972458bfe4cec1e1ae5ef2e761f8e5",
    "djt:claim:c89a2d5a56bcd82870c20e6e0d7221c28894c73f199ca723229660c6ca5f2626",
    "djt:claim:136909ab46b28866b105b4811dfdc1ccbe17cdb361b64802acc5fdb6a4058250",
    "djt:claim:42a9ecdd612a26c890f43aee2c4c389dcd1215e78c903ecff7b2aed0024d890a",
    "djt:claim:6e6ade9f83af9b35115baa261d28cd3f6c51c4c343645f61ca9da7bb7783bb40",
    "djt:claim:c99890bd019cd90373b5e1f7930b36f6d7842fb58dde2ae3c5d56c8c31031486",
    "djt:claim:486dc0f8e418d43797b3cc97f3a0a79aa17e0246cabbf43de7aa86ff82eea0aa",
    "djt:claim:4f58d23d776e5678e8a75e4dd9390e38fe295fa261c7a96c7634302e33a84f4a",
    "djt:claim:5e8be18379fb7a105a0d477e7513bdb727a4a5f7aa4abc2b46dc67b7f9421675",
    "djt:claim:72bec5f240126a1941d902a2b00eec6e0934cd0180e836f0d3f4a95e0c753550",
    "djt:claim:e0dae0287cd81917f9af41f8cda6d4025319161c0cca31b1ffb74b09cff220c4",
    "djt:claim:17cdd05564e62fa45d488a309829ea1e066e3f0abc309b9c29ed9227cdecc3b8",
    "djt:claim:12bd25b9da7ea2ae0debbd83c55f4d6b265a7add097c7aff7402b4663a7f8afe",
    "djt:claim:7f886d2053f9c41d76ed0cc1d1131a676a93d852b66edbc9b764369cf326a6a9",
    "djt:claim:3be2af9ad2db84b15a6c2ea8fc815e976b8635556a37315e51da9cd361ff8334",
    "djt:claim:4490ce814146efc67fd4827e6af8f550d7dd84c7d36377427ec7572c975f1f72",
    "djt:claim:f40e0a4ceb29f7eb439af30412148bdc8a5422aeeeef67b572ded3923b132796",
    "djt:claim:48e75e5939e60f7939bebe31b9d93629e0096c6b140d9099f41d0ddeb507e99a",
    "djt:claim:e195383cac63abc6777b41e580611e77d3625877e5de9bafdc020cea3b2bc669",
    "djt:claim:77d38d09734e5907b4ff201b286667cf88cae5b47b13c583d79cea047fa545f5",
    "djt:claim:8c6de29e6b52195c5b7ec43b40d18ee422d068f86c8a69cded855ccff0ef68fd",
    "djt:claim:e798167cc5c44acd6cc9cee7256f102a16f33b4578233e594f5cee75c5ca38e4",
    "djt:claim:028c946cbfae9a053ebbb47cb9dc8cb6d610645c85627482b7265d96cfc5eb39",
    "djt:claim:b06b17aad90f24e9f986afa69fc18bfe6a366b85bb40a277099c1690bcf8dac0",
    "djt:claim:f0e2f1d8370f2877376687baa8e5092426b5cedde78ddd89b60e20779f71e2a5",
    "djt:claim:941e5a421ffdfbcc8448e0fb71f1c1a97b2494160871c60ec3d7579a2a2fdbe0",
    "djt:claim:b516167b3cd21890566b0463b3b015ae8655947985f7916157d679d5d2d8aab4",
    "djt:claim:b97f9322ed08f4c6180b76c6d87757211054e8163e36c7944862289048387f4c",
    "djt:claim:3c51459d79d6394e72702771efd07a29ad4c7f8ced56175aa4848bf581269ee9",
    "djt:claim:9192010294541d3ddcbd200b7563e68e243b890a963befe8fd0d03f4e65db835",
    "djt:claim:070f43b14156e9403cda54f976f6a8ec6a854d5031ea6a2689e75de1850eeb82",
    "djt:claim:44344a6b3020cf93d556a66aaac38c4bb45fc2146bad6c58342e4ae76eb3d293"
  ],
  "id": "djt-chapter-4-toronto-midland-review-pilot",
  "narrative_question": "What do the preserved Chapter 4 assertions, 2010\u20132011 timeline records, and selected Midland/Toronto records establish, qualify, or leave unresolved about distinct commitments, transactions, and alleged onward payments?",
  "schema_version": "djt-story/1.0",
  "target_duration_seconds": 1200,
  "title": "Research review: Chapter 4 / Toronto / Midland pilot"
}
