{
  "capture_policy": "optional",
  "claim_ids": [
    "djt:claim:2c232c0e87d71d05de9e37516a6d1f2368435f1bd180227eb0f131d01e646449",
    "djt:claim:1b9caa485608b1201d9e2468a87f8dcda0cf0b1fc1c866e659ab38dc59a76090",
    "djt:claim:8176b933d20878cba954f6c40a5f1797ffa5379583a2dbce08dad659b3ea1043",
    "djt:claim:4ce513ae1f933dde845f1f8d6b04846561b87ea2ec60376b6af5a01d76b0c1cf",
    "djt:claim:c7fc049b79a355c9fa910ec551f9728296871945a428b05a042a77f877855dc4",
    "djt:claim:c762308633c2d59115240c80de22e7e0eb187ca9c9824b7e556c251f0cddf62f",
    "djt:claim:05a5aaddef84622f6d2155c53f50ba38d13c17df535d8605173e84652303750f",
    "djt:claim:0bdc58971f1a0b4f63d625c65b0f962e78d5ae31986976e5f5c377b57d4ef70a",
    "djt:claim:1c982fa6c56af22c9039b85ebb8a5e9537a8db32c60b1522646a5de492e1c78a",
    "djt:claim:566f1ca43a4488da8bfd72dd6a87e26819232091a5f391e61d0fd86a1a110483",
    "djt:claim:94b927c63080d760f092b83679607941b8409421782ab9ff2cf8c79b48ce4cfa",
    "djt:claim:7fc041ee1c347c74b3bd3b291ef0d5f3810bece39c0bc475bd78ccefdbeaaeff",
    "djt:claim:a721190e680f20341ab59e0b8a0d2a43c718c252e5401093914b7874d73185e2",
    "djt:claim:9c1572c279e5c79bd5b681bf0ccdc94c55ae4a6903eed9210542f6969507061d",
    "djt:claim:96a1b1c7797ab3d61977f4d5eaf3c324d07034e3d3fdfd9564d936b81b10a844",
    "djt:claim:7bd957b8c532c335ed4c754209f806dd026f037c6831bdc98a87f33fe949e030",
    "djt:claim:2f8dac06491c7a759a0764a0acfb1e0a40c0690e498e42fd80676fa55dba696a",
    "djt:claim:de7a9017fde4948693ec624e079a71e427c77230cb33d6ba9925a0e181ed73e6",
    "djt:claim:a1db3e474b0c923d726708865aff316854e1c598ac17a694fc2415017e883481",
    "djt:claim:001842d069788c0c15b4731420924dbda3c237439974189215ef325a692000f0",
    "djt:claim:63363a9cb33a11c6881de6ca40ee4f374665e5592a11c7f773766a62a4ff60b3",
    "djt:claim:24169962a5c8878bf208390547d0d06f254f44caba6f7aa98c1b92f867467f93",
    "djt:claim:9ea53c96954392f5d78fcfc08945183c2d949dcd0b32d8d44207bad7f7b74412",
    "djt:claim:f72107d806ac33507b4ab340e1a0fa1a2168a291316dbed1a215937f683d4e48",
    "djt:claim:2c47858c0b7f8d9f901f7d62db4cc3e1ee8a8302172552aefcf4700fc80a4ecd",
    "djt:claim:c3d10a7bcf0e5b4e8610d65f7b4cb27d1fad73c65343afddc8ef04c1d4a5d0bf",
    "djt:claim:87a83a55f5c148fff261615112ad0aecea2d3ae82ec5e075853b8307a7404a00",
    "djt:claim:374654222c74b34d2e0445e6f7d00f2afb8785dd906a77d02d87ba76ef503c78",
    "djt:claim:5b95d1f58d4391fb2c392f36dc82dbc3b7c11392f8865a840ac7c807a13a8e70",
    "djt:claim:8d96fca3b45698bb4b645b2818f54ca578e33fd68f22b09df1afeeb7f8cbe4bc",
    "djt:claim:e2b7fb9731c7317642f6fc87e78b9c15797ede5f4cf959ee36c6045455d7c0cb",
    "djt:claim:0933dfe4ccb8275531359cf1b626fa1f0f5466b8bc3bb5ce94a124198ff2c2c1",
    "djt:claim:7f4cfe5cd27ccbc140a6166e67012fe0d63d7758f54001b9fc7eac1d70755605",
    "djt:claim:f0a3d28eaa857dc7913af781fae2c1d1d3cb904a9b2328c9f5b84436504c01bb",
    "djt:claim:7ea038f0491217e0c396fec791993e9b965a548c510cc5501a6a90ee9838efcb",
    "djt:claim:8f857dea28cac184bbf7d167ed241b68711afb86c24311777237f760805bef3b",
    "djt:claim:0a999a9aa009f5d0b5c392758ab08db1d0e79c2c1fbcd2146201dce4ee869db8",
    "djt:claim:6d953722db1b2bd703f4928d008d09c6d09af04d21c0142a1b01452b00ab5143",
    "djt:claim:52ba2e48b1c6d676bc40ae34fdada42cdc87f053dfffbe4dc171523cdec41b6b",
    "djt:claim:e78de031cbd973131fea7bbb23cff905d028e75a8b8041c7b6637707700ce276",
    "djt:claim:9bba9d03257576f1951cac6cde5d2e5c82c810ebcba17af80acdab0801708be8",
    "djt:claim:356fcb3a74c56b11352efc96a8b5a7f6ef2e01a21c06aa8363d5c2ed0d43e8d4",
    "djt:claim:12f22239a69916440d6143e4eaf84aa8b1e339701b677086e91bbafeeac1d2eb",
    "djt:claim:00c811c0c2232a7d5973572d4d63c1ee2d986b7728222c5a15bbab3585769a63",
    "djt:claim:8a3c8138ec87c65237ffa9afbf005a6a38056064c525512985df888b70cd3405",
    "djt:claim:28f256a94b872cdcab43c4bf4be4a97784c5d6ccc5d8f001652129f6d6bb17a3",
    "djt:claim:1471826c4037be1c0d2a65f1bbb5778cf8f5cc3a94c0151a9f05bf9961609ae3",
    "djt:claim:2f68700a68d78a76de33ce6d3fc21a27b4864b9db795b0073dd148b76101a193",
    "djt:claim:8889b9bfc498e62746006c90fa46d56047d78b98d25eb510b013edf89baa4852",
    "djt:claim:08f58683627a6a109344eb31fd548ead5aac610c59057b5061d6ff9a7e17bc9b",
    "djt:claim:0a1aba0a13c563d1391aa1cee95b5f6a36d5d5b48f77662804f2c6ee4f6b9d0e",
    "djt:claim:c3b13537c0353a85383582489df56b63bb309aa5ffa33d44d761e02174b20465",
    "djt:claim:10ea414f3dc70436c77065a5ffb9aca5a8e65cca4cda0c6b05553c136064c246",
    "djt:claim:837bc750c5df7f37b7a1e2dbbd5cebcd9c182dcc6d57f14e8fd0f9493edf95b5",
    "djt:claim:899e83aab9bd1cd8993e51275e40e90b1343e04cb3224bc186b6b7788706f32f",
    "djt:claim:774bb29c53fccb38a41a99f813b25f76ace51643ad265650ace5a034fdff7a63",
    "djt:claim:b82ab84330eea7c8c7116a9adac59f8c159c50e818d527ebcaaf4cf9b4e439ad",
    "djt:claim:bbe4224de2a25a06f156af54019b8d291afbf0b88eca66ecbdaa528d3237c5f4",
    "djt:claim:7d703dceb10c8e4c99b7656c742977c01f80e39682505b470ac0db8f78ae5f07",
    "djt:claim:02f62e6787d45e072661b2e87246c8162dd07f08f4ba617095eb32afc1485ef7",
    "djt:claim:81642772eba059004223dc9f2917b3d8461fac1d8192f286e45f590ee2375034",
    "djt:claim:dcbe7dcc5e8d33b88d7fd70e938a587681b7c1d49f18c25a58747f904404d7f9",
    "djt:claim:73ad6c30035bf4c702edceff8ed2c70a48911cce585bfea099c8b9af6171bd56",
    "djt:claim:10491ab147aee1b873c27a5bd2c8735285de3d083306f6f89ba6c9651faa3e87",
    "djt:claim:aa27d2081b2ba70cf16562aee0312101701ca9587eba8ce89cab3c1b5c86f692",
    "djt:claim:54ed3d255328481e11bdcbf82dc912bd2cca89f31c5f6626ee9562dfe5005e85",
    "djt:claim:09ce1ac59019240300656bb00b258dbc08cd70fb117da90694728654b16a61d4",
    "djt:claim:e9d4c45b148414188ca523c54f51cc20b5c3c77c8f9198ce7fda9d6af4e4ea20",
    "djt:claim:7463d8f4d070c3027b2a61785246651ecb25a5acb083d648d73c6df2ff62cf42",
    "djt:claim:3f568a283f09fecbcf466f83aaf2a220f17551a555c423de976d673dd2500c91",
    "djt:claim:9191c0759983ccda8495b7e55d6fd9989b866f522875c756c8ff8d443e56ab56",
    "djt:claim:3e3b1ff5f23423f82b0dbed099fca1f8e3cae73e9d26d22913870df15a727c79",
    "djt:claim:129beb36d539c8af9176b99690359b7505437eee209cda7d6424bdce3735a265",
    "djt:claim:a2a9a20ee6f329417f9830e85e10420ceeabc79b6e39425cafb65d9b7870186d",
    "djt:claim:d29df6486efd02eccef63bf1c6e9c961a4b4c918fc843d521e765678f9fc3adf",
    "djt:claim:a0065402af7cc2b90b4f88eadc924d83eb86ecb75436d0f8d56fbee07dc1e708",
    "djt:claim:d45c2a4def14d0a3e9676cec8078dbd5205de8c7517910b2923c86f075c8f67a",
    "djt:claim:8db22531d540c202acd8a678bf3887df3de0f0957074e9c546c383a3e035c356",
    "djt:claim:b562aa0b27062c9334cf7e123b117d8d8e5b749fe24c0a5630a7f7699ce5c443",
    "djt:claim:5364e51186af5665b4fbc99c86e9f59f29b5a24f92052ebae453223402b65707"
  ],
  "id": "djt-chapter-7-review",
  "narrative_question": "Which assertions recorded in Chapter 7 have supporting sources, material counterevidence, and unresolved limitations that must be carried into a future story?",
  "schema_version": "djt-story/1.0",
  "target_duration_seconds": 1800,
  "title": "Research review: Chapter 7 evidence collection"
}
