{
  "capture_policy": "optional",
  "claim_ids": [
    "djt:claim:321027fbe57cda21dc7ec69856d5d7a7f3d2cd8962cd950866016d1e3d8d11e1",
    "djt:claim:fa15f79d36fdcc420fca63c8249ea4a25f50764976d93853623868509abe787a",
    "djt:claim:cdb1325a518cfe00a7d5857b0c9c5d316ac1d0f5d6be1721ceac036f1921c373",
    "djt:claim:5c1095698bdba7729df218e9ced8441a492908e6c0a718e8fb039c6b19f02926",
    "djt:claim:ef8bca4fe7aa98bf566b024d6c6fe3b22bebf8ab7a80acbe30bc6eda38d7b254",
    "djt:claim:e44f2821e4e2bed9931b0f2ef0999b764a2d3bc7ed9354a64158299eee21fdc4",
    "djt:claim:b97ae25c213762cdf3e43ccceb3a016472f76687f035093f2e438c68ce9c7f07",
    "djt:claim:a07fdb73ccec8f264e79604b2988b6929bb62f7347b17d15100f4c05ac6336ff",
    "djt:claim:3fecab35d6f4a1847e147acb319b3a060a213a55d53379eb1c338e226b673f98",
    "djt:claim:f7fd2af664c35f6a71c428df0ce45b34d41aa09d78b27cca83088f1fa1edd183",
    "djt:claim:f266a767a906b33ddf6192957313609898c757c836541c653eed3bc6990cbf0e",
    "djt:claim:f5b5f1fd7afa3a595350eb56733056f3c4fb1d203dcf09146e1b8a9c5cc02701",
    "djt:claim:42291f254b94f900e911d5a589e24ddff22d541acd48be28325376f10694d277",
    "djt:claim:7746a711ede9016a11d622cb1815c63a8e9af221cd7286cd9a44035263d765ec",
    "djt:claim:be90dd977460c3d075d418333cd01ead5c8a56a8dd651aa2a56133ccaac299b5",
    "djt:claim:62fcb56bd566b255ddca55d00c78b2c3bb5795805c5d1d9ef9a94dac35a61351",
    "djt:claim:101265fc78788eeeccabd30308d7af1aeec52a005c9966419fa610eef0b1f27c",
    "djt:claim:8b95f81de9290f2469bb47b1b8b25529a86ff4d9f0cc26c7c1ce3e9235bd71ad",
    "djt:claim:a2e65752dbb857e7d9503443d7b5720549b8f64bf6fef38032e558214572e9f2",
    "djt:claim:6bfe124955550b57e3e91cb0f8aff514aeae451cf8fd21821a8244af85aa3e34",
    "djt:claim:1a6e8f077484c9780a6c4b0c434989717d5415abbeb797c09f358a3343fe8bb9",
    "djt:claim:d3e6f731d4c66cea53d92adad915a81b7e8fd542cf3761184106a4576ec6d90d",
    "djt:claim:bb0891029a721c8f4fb36b81adf3fd26af724f22a87be499d9cf303039c33fba",
    "djt:claim:3197fe7c11dbfd9e311110c59ef0ae31fac6b4668d52ace5d9d14d555fc0344c",
    "djt:claim:437fed7f7c8d214e109c8e208a97778961948f5e7a7e07e0b62dcd4291058734",
    "djt:claim:e05ccc038fea572ef4be0c21ca695f6a697f9a727ab4d1adcf2da8246547c107",
    "djt:claim:448f8aa8aff2b23b8c136a5dfbab5ac7ed0e1db0bf6b772a519ad8d7868ff36a",
    "djt:claim:46d59e1b217ff529d591cb570c1f86f6f4e15ce0f5f201fdbce9fd04b07836bc",
    "djt:claim:b9fb805cd50c78ffdd2bd69ecb7c9ea50acd6aa937559927fc75a28eb8eede59",
    "djt:claim:689c39f216169b43ca3d90fa2677fb8a3922788132ed619ccf7153d3d68c75b7"
  ],
  "id": "djt-chapter-1-review",
  "narrative_question": "Which assertions recorded in Chapter 1 have supporting sources, material counterevidence, and unresolved limitations that must be carried into a future story?",
  "schema_version": "djt-story/1.0",
  "target_duration_seconds": 1800,
  "title": "Research review: Chapter 1 evidence collection"
}
