{
  "capture_policy": "optional",
  "claim_ids": [
    "djt:claim:6f4693528e49052ff8ca36a8fdec45f97da6ef4d06b7aaa07ecea20a13e56b27",
    "djt:claim:47eb48a02bf4cb1c864506db092efeb812a88d4ad44663999f2a4e94996d8d6a",
    "djt:claim:bba13489cfdc8465f22cf8e90c1eeab8ba31279bee8daae7dbac8ab1ab3ed06f",
    "djt:claim:6cfe2e64f85cd7ad9f618b48380a8819b76217cd590cd49b12b96591130f5243",
    "djt:claim:4f322b042034ad2a888226f681bcde12751ea4294efc0dcfbffb090805b93e5a",
    "djt:claim:f8a53a490951f7b97fb28b68c25fae01e7bc7b0affcc8b183216d5d489a5e948",
    "djt:claim:9cf4f17226395616be2066434d01e8e46c4cdec67091d3af91cd2dc4484f90ee",
    "djt:claim:ea627739f8837e7177cc4e03c995a13001696db7180c778fd4138b334939f038",
    "djt:claim:677f007e123147193c54b0d3353f283674af34be95521bd1d4f9add1226c3e41",
    "djt:claim:5520cf644da19f169a241797f86874658bba98033351b9e10b30c55567a20aac",
    "djt:claim:c5bb02becf668780fea2afd02ba7e4251ff5ae0850373cba28006a5194ab207f",
    "djt:claim:fe88269043ac6f71f8538edf2002aa90ddfdba922e08669e3b4ab5c190cc9e4a",
    "djt:claim:b24e9ceb6dc7511e6f50ed7a4f24203670a5f9f6bb49dd684ed606119824f69a",
    "djt:claim:d1e24f9ce8f05974e399f446a50bd97117ff18bae6a38e23c75e5552b676ad45",
    "djt:claim:3e03f29d4b46167ee76539e44d08cadf2b277756b4c38d3cbf48e328ee9b1bd2",
    "djt:claim:b0ad0f5dc3b01aa54a2db9d1ddeeecd9b3e814b179c2a499b9c94395986a7d51",
    "djt:claim:adf11d87ee11c5239e50edd869b7a0f24ee8ae897dd7efbd6d94dc18284e44db",
    "djt:claim:f8ee6de3982cceb3079447fb104b826a4f307c5466cdcbb6572f57bbd9fb5ad0",
    "djt:claim:6252b47fb54cbd856577ba31f48f85b5f8838c4ddcc37d23612806574282c9f6",
    "djt:claim:d2ebb6319a232fee16b049afc74e69191df48186df6faadf153354005609ee5e",
    "djt:claim:548004c00886625fd2b04d044c2f7f0a539392beba00449b35a3bb104305f808",
    "djt:claim:786ee9707a4df3f632b1dfbd806e76ab7f536918b85111ce5c2e81ee462ecb31",
    "djt:claim:9663cddb5b1a320f05381152fe5799876fe253bf1675ed49f9bc3ad13fbb2393",
    "djt:claim:31b7265fc94c941a7885159f793ba0cc5d402ab45da30ce4f5533caa34098103",
    "djt:claim:afb308655b37c20f19e89a6995a957e5d00bb677c66222a8e1df67511d78823d",
    "djt:claim:1c58546e17e1ac9bf8d16976fe9f26cf8d9fdde84207a07e9a5ae621da9a7128",
    "djt:claim:cbdc44049f52557e64ffc3f10e2a943f3d972458bfe4cec1e1ae5ef2e761f8e5",
    "djt:claim:c89a2d5a56bcd82870c20e6e0d7221c28894c73f199ca723229660c6ca5f2626",
    "djt:claim:136909ab46b28866b105b4811dfdc1ccbe17cdb361b64802acc5fdb6a4058250",
    "djt:claim:42a9ecdd612a26c890f43aee2c4c389dcd1215e78c903ecff7b2aed0024d890a",
    "djt:claim:6e6ade9f83af9b35115baa261d28cd3f6c51c4c343645f61ca9da7bb7783bb40",
    "djt:claim:c99890bd019cd90373b5e1f7930b36f6d7842fb58dde2ae3c5d56c8c31031486",
    "djt:claim:486dc0f8e418d43797b3cc97f3a0a79aa17e0246cabbf43de7aa86ff82eea0aa"
  ],
  "id": "djt-chapter-4-review",
  "narrative_question": "Which assertions recorded in Chapter 4 have supporting sources, material counterevidence, and unresolved limitations that must be carried into a future story?",
  "schema_version": "djt-story/1.0",
  "target_duration_seconds": 1800,
  "title": "Research review: Chapter 4 evidence collection"
}
