{
  "capture_policy": "optional",
  "claim_ids": [
    "djt:claim:425b73bbad534708c5cb96fa0e9d9f15f39c892f08fb51b29c11bf5a5e3c69a7",
    "djt:claim:93aa9193637eeadc7cf2ac826a6bdfe3f325fb35e812b26014c35c4a22a06055",
    "djt:claim:c783b208a71e62993f171a3e2bf4f41f2a612ef6000783b63dadb28fbcaa4f61",
    "djt:claim:3ba955b7796a05d5e26a5964ebadf54237115fc0e593c80ef48245f22410218a",
    "djt:claim:e25ec1a3b7df97b74c34b54da7ec127f6e25701f76bce301e5741401ca981095",
    "djt:claim:9994824957d970f65c770c38299b4a85f1aced9da20f6b363059f95b0f0fd759",
    "djt:claim:b0e6af3c534645f90e17f3e3d415bd9aa0b23aa2f18fc846b2cca15b82cbb251",
    "djt:claim:b07239cf4eb70050b29737c6022e3cab540c2c731ca53b7ac0e85975d76e9214",
    "djt:claim:ad5d2fc6cd222fb6473b8d4022b28c3da1c737f4efee5271acb9e2b38a9b083e",
    "djt:claim:d02444d5e75ac94194f14173aa380ceb3ac774b90cef98e27bba911cc11f8d74",
    "djt:claim:97450cc0268295a8f0a3e1e005c0270e65aa2969bd21603b84902253a6788a70",
    "djt:claim:74afbd5d8bc5adfd256a6b06e3c74ea890dcd122d60ed60d42d11e9218b2f14a",
    "djt:claim:3b16ff66c9354ccb3771be6c8a7fe9ad21f7e6035c265bb078cfde358197fec3",
    "djt:claim:17e85535068ae4eefee8bbbd0e513eab417612c1543abcd6868fc3e884d47330",
    "djt:claim:76778eb48ec46bce23deae5b4fb9f6191a5a1d076eb5c0caf0f24843af54eeaa",
    "djt:claim:3fccfc1a7a25dcf2a201406a541f5fe6d908329903d60f4cbed011930ae6f1f4",
    "djt:claim:b6ed9139518be8e56f2d1183ce4c99604c805c3d138be1f979cb2228146c228c",
    "djt:claim:9817d4337ec7a44406a0e0529716add70fd1a2bf25b2786169f2e6d537977405",
    "djt:claim:3be6a2141125c62c0ca8bad3256c1289f045c93c2c615a1f52e1c45e9890843c",
    "djt:claim:4ae80577a560e8c265c90684f11ada120310b4e66b765f728349ac893711016e",
    "djt:claim:456f75d6e0de44617fa9eaf93dfb1e4298dd12277cdb971fa948ca63898f41f9",
    "djt:claim:9b4a54268dc3a02eb2b82791617dae3e3143e22a25980bae357370907c59f32c",
    "djt:claim:cb2d606a38be3cdffead4f5e225df191f73f6e35c2c1e0c13e0b2c69c308af6e",
    "djt:claim:6380e2d4841fb4251f661c0c1a8d035c2d58d1708109270272abb9dcb4618cfe",
    "djt:claim:ef016474df6aa06484fc6f9724bab78a5371f7260b8ca5127878121cc22c5f97",
    "djt:claim:eb2b80b6c04e457b6a52f64c3720ba7746d955b9f902ff04e25a3bf446dccce0",
    "djt:claim:a85affcae647f55312d185558c9ffeda45ce8f0c24c8bb5657c5bf22a33c1f91",
    "djt:claim:02a85fccf648ef901e3a5a85107982aeeba48755d65c0f6018220bd36b16c814",
    "djt:claim:8fc80ea6af8f8491c21f113facb497dfa64a2b894df5b2a8b99dfff7d5c489e0",
    "djt:claim:d4256017ee32b74d3bb46dff6814c690aaf7737480c2e7a4c24033a728ead28f",
    "djt:claim:2f62c737238e733c2468d2da191084c6a13873a67239d56900618759786589a1",
    "djt:claim:83066413d4f3a77fb31d811e4feebcc88e9c1ef3f458fa8f79cb42a7608be68b",
    "djt:claim:9b80b171a58078f50edb3032071232efbbab1b9dea63b8960b3551e5f8b6f587",
    "djt:claim:31b2c09dabe2113068eeeba186d493249997e8f8eb71b0d1aad8c8d8139bac96",
    "djt:claim:49e744d6fd538e6b6e055823cdc9dcc3fc0cbc07ecc7abde7e9f03fb9feea57d",
    "djt:claim:2ce1adcb69e6d69a5911bcf7ad57802dc26cb931eb8948aa845163bdfb000627",
    "djt:claim:9a503dd0076a1fa4976d95c3f1d4347e8a04430f889644fbfaee864fbe3fd9c2",
    "djt:claim:0b6fb7c60b8b3bd46bd73c7fb916036db2a6459fe548dc5cf043e0ac87bab737",
    "djt:claim:5808c30e57a049764f925cef875fb06a3cc66c44a0dfd7718e72fbab0e514034",
    "djt:claim:256ea828d81c60cbf0ad23fb68e409d5dfa03aa34ac25aac50055f8afc9cdf72",
    "djt:claim:34c60cff33fd3cd72764c98951cff6bd196ffbe3b4372dd283e1d039c4d8d940",
    "djt:claim:793b427f2363afdc8dfd0e0a32c8b522a336dfae7beb58af9e1d6b1726c4f543",
    "djt:claim:dbe3aaea910a6a0d7ae8a88f10c7309e7e16d505406b9d58aba9f4564cf8e7cf",
    "djt:claim:fec74d0cf1903b47f5145f8d77b2265ed6199ab04e4d42d13ab872996c0823e4"
  ],
  "id": "djt-chapter-6-review",
  "narrative_question": "Which assertions recorded in Chapter 6 have supporting sources, material counterevidence, and unresolved limitations that must be carried into a future story?",
  "schema_version": "djt-story/1.0",
  "target_duration_seconds": 1800,
  "title": "Research review: Chapter 6 evidence collection"
}
