{
  "capture_policy": "optional",
  "claim_ids": [
    "djt:claim:3135ce7c2b9842a1e4d435558e269a756d655c42173f1ca9799dad6943c88436",
    "djt:claim:5699dd8cc1aad2c17861427faaac1ff551b9780688e35e459942ac0e756346b3",
    "djt:claim:d581e889fcf1fce6a40bd9eccd90f4476de9b580d16f6cfb5170cdb930e8539d",
    "djt:claim:0b89daead75d0dcbf442dea1886eb156fa46b57fdac70b4d12516c896b5f0f3d",
    "djt:claim:395c779b529eadf4a0fcb4e196bdbe855805c0b7488ecd8ada6e6709bde65bd8",
    "djt:claim:c19819543ba54182a57747f9338df4f137b933abd0e42c493f5ef6f7b753ef0c",
    "djt:claim:105b00d38028f5a1b2d2e02d123c9aa734e7348d47ea4fd14690355b286d39c0",
    "djt:claim:0c473d3741d92a2722dc907149963cedc185c1640cf34f539c6c5dc51f0610da",
    "djt:claim:22eb2bf24c01b78af21bc9f2a0e16ab22f6642370b7d8729fb6a3fad4f23ac8a",
    "djt:claim:46a3258487e8cf01a7e91d5337f95da6054d877b17b0e67e092cbc33255e0595",
    "djt:claim:e591a35dd7fa0dbbecc9d8c4141093602bfb9c42e3906746b0ea8092ed628aae",
    "djt:claim:11170ade0540fa17ac197a7533f74c06f275874c5858b9016579685b5e64920d",
    "djt:claim:e5638257fca4754f3b5d251dc8be8ae3ee90c08cf46b0912030397c58631952e",
    "djt:claim:17baaf8ac0c922b14226521d3bdce796f40ced6274ab6671eaf922bc1e1e37a7",
    "djt:claim:d0fe736ad866963dc085a1c77b65005dfbbcbe1021a3905140e47b13854a3a1c",
    "djt:claim:069b6e2f7fc937324552c1e420178907519a4403fdd3a9333f299b9c8c5e1515",
    "djt:claim:f3e07d55082e33928bc22bd38c0260152b032e28627e046314e0fb6dffcd5d65",
    "djt:claim:58c4a321d75651c6060e11595825d07e1b0b42430e0a239fb343523111648c1f",
    "djt:claim:725f5d6ef012c04719063581d0fc4719ac15f7265195dc370d7335f9a0481ca0",
    "djt:claim:9c429bc28276a5cf3092b048fc8c4d4f77d1d9119129b91bd01f2561cf3bfa60",
    "djt:claim:377c1f98c677bb1e5b18fae4d5bc0cfc1514929cb0e9073e68943524b4ebe0be",
    "djt:claim:8295f3a46c8b84efc33538b037e51083d8fbdcf97dfe39c4e412b831ca83a22d",
    "djt:claim:ff120ffffd77fe4611be81828b8675aa1fca3a9eb2901588fa9ff0288c776907",
    "djt:claim:101df4711c3105ae5b7fa2a681772449f2579cb2dce9bd5b557e6a385ddbd1b2",
    "djt:claim:777d7ad18026088a69cd97928866bf70d0fb564aa1210bf1a8f8196c283eaeb6",
    "djt:claim:c606263706258f07c2795c669b700eb19733d06257cd5114540cbdc01ae384cc",
    "djt:claim:04c0bfc1148d7af1368d565f304ddfc933a1126f212fda9527253b5624a02bb8",
    "djt:claim:aab040090edf02015f630cf66dc4534bf8cd1de1ea1ed16ba775254a9143aa46",
    "djt:claim:af6334c540b6b481a3e1688174e9dbde27bdf706b8e9a1c095989936c60816b5",
    "djt:claim:49f569a66fd2cc0597cf607d5954f32d9593df3f56865372b07db55650738279",
    "djt:claim:b477c5e7e22e8288f82c66c4e1883de17c5d9ae234a755278121192172362e28",
    "djt:claim:e47de5ddde5ee401222b0e07a3d095459fdccd115e844b7a3a13b39ff05efbfe",
    "djt:claim:19477df6cbd9fbf8a9ee351a81e4d63357584e1d9f1fc01b64d2bc5495442d08",
    "djt:claim:2c1078da4d82fd188d5c946829d38fddfae9258380f02af302591d58d77da92d",
    "djt:claim:3922cfa9649beed7486776529603434262ed59e4e1bc64189954033c792f479f",
    "djt:claim:ab50e66afd7fa12c4de3c2a819591e89a4d0099fac02cdf56f50e55e5205c2fa",
    "djt:claim:461a9ee7db8567395bad60f2e65e1deb9d5da38f0f9f6cd9bae5de63c41d3656",
    "djt:claim:9b252c179144fb3e478d2b145d88e6c71e1cde0eb470aeffddd45de6089031f0"
  ],
  "id": "djt-chapter-3-review",
  "narrative_question": "Which assertions recorded in Chapter 3 have supporting sources, material counterevidence, and unresolved limitations that must be carried into a future story?",
  "schema_version": "djt-story/1.0",
  "target_duration_seconds": 1800,
  "title": "Research review: Chapter 3 evidence collection"
}
