{
  "capture_policy": "optional",
  "claim_ids": [
    "djt:claim:7bf9434c8a188dd964df5cc2854b7bc0bc803700126da2727eecdc4c47b2dcc4",
    "djt:claim:6267e932aa33cf843e9f8041f1476749fa8184600d62c2c41c49a10fc280ebd6",
    "djt:claim:df509f3bdff5d42e38e2340f94a37524a5854f4ed3a30f930fae7fea1b927cd4",
    "djt:claim:f7ad51db3683ca8830acf9ed9ca6c17429445ae45322faae740448a9bd7e48ca",
    "djt:claim:516fd2d426ae6ded0b84b1f394c43f724e6633f016cf8faa4241139839ed46a0",
    "djt:claim:2db911a1efbb4cb8574496b25aa80e6ba83c0a916b103bc1b932455cd3b12e78",
    "djt:claim:e4163e15ddc56f65dad16f6f906a876326c0c00f839ee8331c71aa55df75b479",
    "djt:claim:0781ce5d887017a28a0a833957a0e3fdf54cb34c7ee04e001ef6d15602c33e67",
    "djt:claim:ecc86b30db7cddc6aa2371629fe09b34aa5db3528cb19d31ee78d6a79b28c844",
    "djt:claim:e4177f9c052fd64f1eb3f330daf21cca433a9eea313465ef932e8fe891044e39",
    "djt:claim:d16a101f991e9353c9712c05c7c96ca0cd7305287d0605a89672548347132727",
    "djt:claim:5bdc0840d8cea0ba2b9ca2289ae130616fcca05028ffc0eafd408f66ced0ca74",
    "djt:claim:f50468aab687108920b6643e7d757b0cd91bda60e8ab72fbcf4518cdd43f8b8c",
    "djt:claim:4e5fcc2339f3570c78ca6d458c26dd4dcd0008045265d413ffbfa9cfc7daf31d",
    "djt:claim:cf24fb447054a0f8c6a462c0d1402a7c1152db0b96b718974e9734cac402823e",
    "djt:claim:b9742997bf90318963a2b8528a3bfdb02efade42877dcad685af952cf6a803e4",
    "djt:claim:a271e03054d97897969871c2973ab4aafee444aff2ced49977bf38fd475b2ab8",
    "djt:claim:885db0f9c28bc9bb6efaeb0c34a31d0100de8ad0e6b9c383b4c16713d23f883e",
    "djt:claim:7c95203df1d1b81c35e9e9df688f2ec9d2a6797c8a841fcba0cb3fa30822c219",
    "djt:claim:2f6d0af1bc2caf9b3f6d3220a67cde94bc3d36e015d66011964076fddc5fd731",
    "djt:claim:e80c80c0af43451e7b62c0b8e3424a476e1364f76061595f49e103942d01b710",
    "djt:claim:931571c16f144552ebab454f09d24717c845fd503f4a935ff175324dc229add5",
    "djt:claim:cb7ac8f0e2be2214a512a6123c09dd2d9bf1f332cb17ecddcd8d0b77ebada9e4",
    "djt:claim:355f8e126f413a04036b3abe098157bf80f862738d26685e65366e59ee3516c6",
    "djt:claim:d94ae0e7b3ad60c87cdcbaf02f9b404a3db680a7b800b44a0dbfddb1a3581383",
    "djt:claim:049914a81488103ea8dfcaaa77b51f83c6494bfd1bbcb2e469264686bb444f54",
    "djt:claim:5d53f2de5f93c0fb9d9bd2b2c2a07e37efd0c854b320df89ef05725fd2cd0e10",
    "djt:claim:651bacda56b1fc5c3c08d8db4c39b8860ed82f4ec4cea237ff28688ad90e7288",
    "djt:claim:71a7aeb184846e10337dff0feee50331ea3b7fe36e866b1971f4ffef205ea170",
    "djt:claim:d74e250e94d0661ec523d8a215cf073d4bede6596f5efc09dd6fd4e349b50dde",
    "djt:claim:726293d4cf03ebf088f63a81808951508deda1d7ea947555f36bda3ab9e07694",
    "djt:claim:a9f4682d1d252e6d13a46408ca728986a027016c6cbfcbcfb268b9b396ae9e22",
    "djt:claim:de4b73e52d74398bd41c0b1f0cbc5152f0375ea12f792d0daf93584d2f733921",
    "djt:claim:3a456b405a42d2ff20c82b5289115f5c9edcb6d35052d1d0dc2e89ffa31e7775",
    "djt:claim:eaef3874cff888ed6dfb1a74473b3b0a0b5c5728aad470687239f8f368d4ce61",
    "djt:claim:acd67083604e0e28215816c0571ece4ce401d0d64358d9e5c7e54d7f38a4634b",
    "djt:claim:9aeccff7b25941468310718bdceb0b9a0946034e8490ea88139620d22c1532dc",
    "djt:claim:1b9f37f37d5fe805840adc98a3648fd9b5df1a57f8151bb931cc8890860f65a4",
    "djt:claim:1cc01b2965c0a783f4d428e0f297c0ae664fefb23f4f3f8645bbf0351975f558",
    "djt:claim:c70b5784e37af161049f7ac1cdf2c686e92c5bac44f7fa138bfe525b68dab40e",
    "djt:claim:b386e16aa120a69820eb518a388af1eac8b277872259da2b8403a75329f186a9",
    "djt:claim:d8fd5d8c0021832e6f4bff5128fe60b4a680bc394ac733b13b0a3fb038c1735e",
    "djt:claim:26e13b8fde5a9680bab409f6b666e78d35747b745aa669b852ffbdf5abda38b9",
    "djt:claim:07541264f49cfe63376a6556913bd903842deca58ee55f9861189d36e595917a",
    "djt:claim:c8d7180fe9ac03dbb6d6aa1ad34792c9a5b5d284060f50c0f55f8f0b82c53b49",
    "djt:claim:d76f6694931db12d0c75761cd8c90d1e693bc15c21acb90bc98784f4bfecbab2",
    "djt:claim:e4556aeb53ceb6d26e2f24ff2e7e00a838da81eae17ab698acfc45f1fd4e00c9",
    "djt:claim:a755b6fd61ca8acb965cffd1ff64a1295f9708d00a0da5bb4469eaefcb71cc62",
    "djt:claim:312644c71e1d43046683414bd454219741a6306e02c45427845c6a5f239af1e9",
    "djt:claim:cbc78b9d2385ef2ccc7a00cb79363b5338a6b92c1c42d38e6300e8e0c893ed4d",
    "djt:claim:d9a2fc4ef574d6e71af0dea5415787ca014f992c76ec21f09efd72a6bfb3a39b",
    "djt:claim:dff3ffafca4b224c2e0c4763e58019af5cdc8d765c7ebd2c3c95e6ee97443ca6",
    "djt:claim:1b40c701312495a56352e94a9c4da7f914c09abef3dd5fd48d72c0eb9bcc87b2",
    "djt:claim:3a458fe5e996c4bdcc13f438fc808489b1c706d163508893651b2ac7c966715d"
  ],
  "id": "djt-chapter-5-review",
  "narrative_question": "Which assertions recorded in Chapter 5 have supporting sources, material counterevidence, and unresolved limitations that must be carried into a future story?",
  "schema_version": "djt-story/1.0",
  "target_duration_seconds": 1800,
  "title": "Research review: Chapter 5 evidence collection"
}
