{
  "capture_policy": "optional",
  "claim_ids": [
    "djt:claim:648a2b0323ee34bf3fda06ada5422a7431990872d701e7d625b4002fb1b52699",
    "djt:claim:029c69a2dbf41ef6787cea772347741860bb9dd8a7abe4e953b61ce21af5e0a8",
    "djt:claim:8467043c6345f9108709fc058ba902bfa312dc9047406d38a0f33e690fd42376",
    "djt:claim:5ef1f99199856fc14fcdc90f842c4acec8d631016928828adade402dd3d007d5",
    "djt:claim:c7d3a6ea1b04a564518ce50c10dae04444bf304772d1a0c1760dc1a47b07b21d",
    "djt:claim:80b5e1cba48eaa2d46ed31a34d70dfa732e3af8d05bb28df6805e9dfe9f1670d",
    "djt:claim:b752f73538eb2f21c72337b536e29af3899917cb851630860fc0eb985b531516",
    "djt:claim:b48d8454b07bd4a931cd3553cfbd5545353e5df4bbfe840da3e74263e212801a",
    "djt:claim:d1f5157e3523140de0cf024a69b7f3b431227938b05eaf5035fb015ab4a64b1f",
    "djt:claim:ea1ee0a485e17dfb97277b8e794978e1ad02a875a5fcda1d7eb7b3b9948ee667",
    "djt:claim:9c55062d742fb98227f1a99ee3764661da3bf39ff5453dbe92ad2c96733d7536",
    "djt:claim:3a638c0164c667161ed75c178f395b75b002e62f27dd35e4471c0d1ae7eb3408",
    "djt:claim:ca6dac1bf6ae3a116fa03068ac4614b7edfa9039ad3725eeff68f0b0b4919074",
    "djt:claim:04fe21232a667d0206764da50b222ccd2edb1c64c34b88c5e03ea854ba1cd860",
    "djt:claim:cf897aed634c39a285ce2a460c18a683daba113b060a5e063372c6fbee71d8c7",
    "djt:claim:f8875437d0ef14bef1bfc9ce97e61cf77fee50f3e650920580a8d2f0879ba190",
    "djt:claim:c531d52658d2743fc4441efd6a63a5f31944677b772bd382d73db6be5197573f",
    "djt:claim:e05e776b4aed0b0009fe77eef855fae3b30e162a37fa7d249a1d2f6bf9f85abc",
    "djt:claim:934d190577318e57686249307751e39bbc6b3ea8837bd99b16d17a27ea140193",
    "djt:claim:59c841182a37d32e2c49814fb83430d287f1129a669971696a69dbb3d129866c",
    "djt:claim:9109a4fd747c2583d45ce1f0dd76350a7af127b5ff444611de2e0aef2aa93077",
    "djt:claim:ce7a5bfddc00a8d5fdc4dbf419e6678eaf27d3f4585081578064bcc073a1ef71",
    "djt:claim:26e69fef54c84b29d4019aa7d0591543244cc89c233dd8b2e8ff0a3f1acc3e0c",
    "djt:claim:715e55ffe0735d0f9c75309ab19ddba1ea9552807a49a236e5001d64d3d9a915",
    "djt:claim:b6bde9cf7e116e76e388c886fb782a3f88034d172e8740137966fb3b966730e3",
    "djt:claim:4624681b7fbc3cb08dd801f2b3d45f85b191cb9566b7c25d7f9e4d63dd72985a",
    "djt:claim:35db98cf25e5431a3967f8e16491abca1832817056de251163fbf02aef4b312e",
    "djt:claim:447bd826d2c7aa7d9ccfe34cccaf2ce2efed7c6326243bb586c849e5a402eaf0",
    "djt:claim:037a8854cfa57198f3ef4877d90847892d6e4ab03f22ff5b9d6151410bc454fa",
    "djt:claim:f56161391c6a7c74fcbe33f7cfdc61c3373361b346448f00b48d91ed4bbc7ad1",
    "djt:claim:b6dabc2346dc213d67290b2e8b22a033f82f2da4b17df9701f21ef348a0d48ab",
    "djt:claim:86299a7fdff325b72ac43a78b5db63bb1dfd25ff0ee035df03dc9f90bf3a4635",
    "djt:claim:3aab23ee15d49a3679af5033895f3854079263b8f04f4cc8303e8fe04e10785d",
    "djt:claim:544ec793d3adeb88029543c65bec90a67fa7e6dae5bd3f734b312cbd75d046e1",
    "djt:claim:5e75d6638ba65e6e3fd1a2a67bc36cbfc765728753f7b24e96ec3622b2662785"
  ],
  "id": "djt-chapter-2-review",
  "narrative_question": "Which assertions recorded in Chapter 2 have supporting sources, material counterevidence, and unresolved limitations that must be carried into a future story?",
  "schema_version": "djt-story/1.0",
  "target_duration_seconds": 1800,
  "title": "Research review: Chapter 2 evidence collection"
}
